planName,data,talktime,description
Beginner Basics,Equipment & Rules,Introduction,Learn what badminton is, the basic equipment needed, and simple rules for beginners
Serve Starter,Serving Skills,Accuracy,Learn how to perform a correct low serve and understand service courts
First Skills,Clear & Drop Shots,Control,Practice basic shots to keep the rally going and build confidence
Court Awareness,Court & Scoring,Understanding,Understand court lines, scoring system, and how a match is played
Game Ready,Beginner Gameplay,Confidence,Combine basic skills and rules to play a full beginner-level badminton game

